{
  "t": 1834000,
  "period": 1,
  "ball": {
    "x": 10.2,
    "y": -4.0,
    "z": 0.1,
    "v": 14.3,
    "owner": "h8"
  },
  "players": [
    {
      "id": "h8",
      "team": "home",
      "x": 10.0,
      "y": -4.2,
      "v": 5.1,
      "heading": 12.5
    },
    {
      "id": "a4",
      "team": "away",
      "x": 14.0,
      "y": -1.0,
      "v": 3.0,
      "heading": -170.0,
      "body_heading": 175.0
    }
  ]
}